{
  "openbook_version": "0.2.0-draft",
  "sequence": 105330,
  "timestamp": "2026-09-19T14:41:03Z",
  "publisher": "acme-feeds",
  "msg_type": "update",
  "fixture": "EVT-88213",
  "market_type": "market:spread",
  "segment": "segment:soccer:full-time",
  "line": -0.5,
  "source": "bigbook",
  "status": "open",
  "reason": "goal",
  "references": [104871]
}
